{
  "schema_version": "1.0",
  "analysis_id": "44444444-4444-4444-8444-444444444444",
  "created_at": "2026-09-21T08:33:00Z",
  "risk_level": "insufficient_evidence",
  "consistency": "unknown",
  "title": "暂时无法确认目标页面行为",
  "target": {
    "type": "deep_link",
    "display": "campus.example://open?token=REDACTED",
    "redacted": true
  },
  "summary": "链接结构可以解析，但目标 APP 的内部协议和实际业务行为无法从现有证据确认。",
  "claim": {
    "summary": "打开校园服务",
    "subject": null,
    "purpose": "打开校园服务",
    "requested_data": [],
    "intended_target": "校园 APP"
  },
  "observed_behavior": {
    "summary": "已发现自定义 Scheme 和脱敏参数，但未能确认目标 APP 接收后的内部动作。",
    "subjects": [],
    "purposes": [],
    "collected_data": ["token（已脱敏）"],
    "destinations": [],
    "actions": ["deeplink_parse"],
    "evidence_ids": ["L01"]
  },
  "differences": [],
  "recommendations": [
    "不要把未确认的链接当作安全链接。",
    "核对目标包名和 APP 来源后再决定是否继续。"
  ],
  "evidence": [
    {
      "id": "L01",
      "source": "local",
      "title": "Deep Link 静态解析",
      "detail": "已解析 Scheme 和脱敏参数，但目标 APP 私有协议未公开。"
    }
  ],
  "uncertainty": {
    "status": "insufficient",
    "summary": "缺少目标 APP 内部协议或可验证的执行证据。",
    "reasons": ["目标 APP 私有协议未公开", "未执行外部 APP 动作"],
    "missing_evidence": ["目标 APP 接收后的内部行为", "C01 云端页面证据"]
  },
  "sources": {
    "local": true,
    "cloud": false,
    "ai": false
  },
  "token_usage": {
    "request_count": 0,
    "prompt_tokens": 0,
    "completion_tokens": 0,
    "total_tokens": 0,
    "model": null
  }
}
