{
  "schema_version": "1.0",
  "analysis_id": "33333333-3333-4333-8333-333333333333",
  "created_at": "2026-09-21T08:32:00Z",
  "risk_level": "low",
  "consistency": "consistent",
  "title": "校园讲座报名信息基本一致",
  "target": {
    "type": "url",
    "display": "https://school.example.test/security-talk",
    "redacted": true
  },
  "summary": "页面主体、报名目的和数据需求与海报承诺基本一致。",
  "claim": {
    "summary": "网络安全讲座报名",
    "subject": "某大学网络安全中心",
    "purpose": "报名网络安全讲座",
    "requested_data": ["姓名", "学号"],
    "intended_target": "学校讲座报名页"
  },
  "observed_behavior": {
    "summary": "页面位于学校测试域名，表单仅包含姓名和学号。",
    "subjects": ["某大学网络安全中心"],
    "purposes": ["讲座报名"],
    "collected_data": ["姓名", "学号"],
    "destinations": ["school.example.test"],
    "actions": ["render", "form_display"],
    "evidence_ids": ["L01", "C01"]
  },
  "differences": [],
  "recommendations": [
    "提交前仍应核对域名和主办方信息。"
  ],
  "evidence": [
    {
      "id": "L01",
      "source": "local",
      "title": "页面和表单",
      "detail": "本地预检显示学校测试域名和姓名、学号字段。"
    },
    {
      "id": "C01",
      "source": "cloud",
      "title": "云端页面主体",
      "detail": "云端证据未发现跨域跳转、下载或外部唤起。"
    }
  ],
  "uncertainty": {
    "status": "known",
    "summary": "当前证据覆盖了页面主体、目的和表单字段。",
    "reasons": [],
    "missing_evidence": []
  },
  "sources": {
    "local": true,
    "cloud": true,
    "ai": false
  },
  "token_usage": {
    "request_count": 0,
    "prompt_tokens": 0,
    "completion_tokens": 0,
    "total_tokens": 0,
    "model": null
  }
}
